{
    "$schema": "../item.schema.json",
    "name": "Tanga Berry",
    "name_plural": "Tanga Berries",
    "description": "Weakens a supereffective Bug-type\nattack against the holding Pokémon.",
    "price": 2,
    "hold_effect": "HOLD_EFFECT_WEAKEN_SE_BUG",
    "hold_param": 0,
    "pluck_effect": 0,
    "fling_effect": 0,
    "fling_power": 10,
    "natural_gift_power": 60,
    "natural_gift_type": "TYPE_BUG",
    "important": false,
    "registrable": false,
    "field_pocket": "BAG_POCKET_BERRIES",
    "battle_pocket": [],
    "field_func": 8,
    "battle_func": 0,
    "kind": 0,
    "unk_e": 1,
    "sort_index": 31,
    "effects": {
        "sleep_heal": false,
        "poison_heal": false,
        "burn_heal": false,
        "freeze_heal": false,
        "paralysis_heal": false,
        "confusion_heal": false,
        "infatuation_heal": false,
        "guard_spec": false,
        "revive": false,
        "revive_all": false,
        "level_up": false,
        "evolve": false,
        "attack_stages": 0,
        "defense_stages": 0,
        "sp_attack_stages": 0,
        "sp_defense_stages": 0,
        "speed_stages": 0,
        "accuracy_stages": 0,
        "crit_stages": 0,
        "pp_up": false,
        "pp_max": false,
        "pp_restore": false,
        "pp_restore_all": false,
        "hp_restore": false,
        "hp_ev_up": false,
        "attack_ev_up": false,
        "defense_ev_up": false,
        "speed_ev_up": false,
        "sp_attack_ev_up": false,
        "sp_defense_ev_up": false,
        "friendship_up_1": false,
        "friendship_up_2": false,
        "friendship_up_3": false,
        "unk6_4": false,
        "hp_ev": 0,
        "attack_ev": 0,
        "defense_ev": 0,
        "speed_ev": 0,
        "sp_attack_ev": 0,
        "sp_defense_ev": 0,
        "hp_restore_amount": 0,
        "pp_restore_amount": 0,
        "friendship_1": 0,
        "friendship_2": 0,
        "friendship_3": 0
    }
}
