{
    "$schema": "../item.schema.json",
    "name": "Mental Herb",
    "name_plural": "Mental Herbs",
    "description": "An item to be held by a Pokémon. It\nsnaps the holder out of infatuation.\nIt can be used only once.",
    "price": 10,
    "hold_effect": "HOLD_EFFECT_HEAL_INFATUATION",
    "hold_param": 0,
    "pluck_effect": 0,
    "fling_effect": 25,
    "fling_power": 10,
    "natural_gift_power": 0,
    "natural_gift_type": null,
    "important": false,
    "registrable": false,
    "field_pocket": "BAG_POCKET_ITEMS",
    "battle_pocket": [],
    "field_func": 0,
    "battle_func": 0,
    "kind": 1,
    "unk_e": 1,
    "sort_index": 79,
    "value": 0
}
