{
    "$schema": "../item.schema.json",
    "name": "Journal",
    "name_plural": "Journals",
    "description": "A notebook that keeps a day-to-day\nrecord of your adventure so far.\n",
    "price": 0,
    "hold_effect": "HOLD_EFFECT_NONE",
    "hold_param": 0,
    "pluck_effect": 0,
    "fling_effect": 0,
    "fling_power": 0,
    "natural_gift_power": 0,
    "natural_gift_type": null,
    "important": false,
    "registrable": false,
    "field_pocket": "BAG_POCKET_KEY_ITEMS",
    "battle_pocket": [],
    "field_func": 0,
    "battle_func": 0,
    "kind": 0,
    "unk_e": 0,
    "sort_index": 255,
    "value": 0
}
