{
    "$schema": "../item.schema.json",
    "name": "Hard Stone",
    "name_plural": "Hard Stones",
    "description": "An item to be held by a Pokémon.\nIt is an unbreakable stone that ups\nthe power of Rock-type moves.",
    "price": 10,
    "hold_effect": "HOLD_EFFECT_STRENGTHEN_ROCK",
    "hold_param": 20,
    "pluck_effect": 0,
    "fling_effect": 0,
    "fling_power": 100,
    "natural_gift_power": 0,
    "natural_gift_type": null,
    "important": false,
    "registrable": false,
    "field_pocket": "BAG_POCKET_ITEMS",
    "battle_pocket": [],
    "field_func": 0,
    "battle_func": 0,
    "kind": 1,
    "unk_e": 0,
    "sort_index": 56,
    "value": 0
}
